ControlID,Domain,DomainCode,ControlTitle,ControlDescription,Question,RequiredEvidence,EvidenceItems,Status,Owner,Frequency,ScoreNumeric,Weight,Notes,SourceRef,Tags,UpdatedAt,DocControlId,ComplianceStatus,Criticality,Observations,Gaps,References,EvidenceCount,AvailableEvidenceCount,EvidenceArtifacts,EvidenceLastCollected,ExcelControlId,MCSBMapping,CISMapping,NISTMapping,PCIDSSMapping,CSACCMMapping,IANSMapping,RiskSeverity,ImplementationGap
SEC-GOV-0010,Governance and strategy,GOV,Define and implement DevOps security strategy,"Mandate the security controls as part of the organization’s DevOps engineering and operation standard. Define the security objectives, control requirements, and tooling specifications in accordance with enterprise and cloud security standards in your organization.

Encourage the use of DevOps as an essential operating model in your organization for its benefits in rapidly identifying and remediating vulnerabilities using different type of automations (such as infrastructure as code provision, and automated SAST and DAST scan) throughout the CI/CD workflow. This ‘shift left’ approach also increases visibility and ability to enforce consistent security checks in your deployment pipeline, effectively deploying security guardrails into the environment ahead of time to avoid last minute security surprises when deploying a workload into production.

When shifting security controls left into the pre-deployment phases, implement security guardrails to ensure the controls are deployed and enforced throughout your DevOps process. This technology could include resource deployment templates (such as Azure ARM template) to define guardrails in the IaC (infrastructure as code), resource provisioning and audit to restrict which services or configurations can be provisioned into the environment.

For the run-time security controls of your workload, follow the Microsoft Cloud Security Benchmark to design and implement effective the controls, such as identity and privileged access, network security, endpoint security, and data protection inside your workload applications and services.","1. Are CI/CD pipelines (Azure DevOps, GitHub) integrated with SAST/DAST scans to block insecure code?
2. Are secrets, credentials, and tokens stored in Azure Key Vault instead of source code/repos?
3. Are DevOps audit logs (pipeline events, org changes) exported to Sentinel or Log Analytics for monitoring?","1. Pipeline definitions showing CodeQL/SAST/DAST steps ( azure-pipelines.yml, GitHub Actions YAML).
2. Azure Key Vault secret inventory ( az keyvault secret list ).
3. Azure DevOps/GitHub audit log export ( az devops audit-log list , GitHub audit log API).
4. Sentinel rules/alerts monitoring DevOps activity.","Pipeline definitions showing CodeQL/SAST/DAST steps ( azure-pipelines.yml, GitHub Actions YAML) | Azure Key Vault secret inventory ( az keyvault secret list ) | Azure DevOps/GitHub audit log export ( az devops audit-log list , GitHub audit log API) | Sentinel rules/alerts monitoring DevOps activity",Complete,,,100,0.85,"Observations: Using Azure DevOps - with SAST, DAST (Veracode)","Excel=CSF-AZ-GS-10 | MCSB=GS-10 | DocID=GS-10 | CIS=4.1, 4.2, 16.1, 16.2 | NIST=SA-12, SA-15, CM-1, CM-2, CM-6, AC-2, AC-3, AC-6, SA-11, AU-6, AU-12, SI-4","CIS:4.1, 4.2, 16.1, 16.2; NIST:SA-12, SA-15, CM-1, CM-2, CM-6, AC-2, AC-3, AC-6, SA-11, AU-6, AU-12, SI-4; PCI:2.2, 6.1, 6.2, 6.3, 6.5, 7.1, 10.1, 10.2, 10.3, 10.6, 12.2; CSA:AIS-03; DocStatus:Compliant",2025-11-11T17:51:32.035526+00:00,GS-10,Compliant,High,"Using Azure DevOps - with SAST, DAST (Veracode)",,Meeting Notes,4,,,,CSF-AZ-GS-10,GS-10,"4.1, 4.2, 16.1, 16.2","SA-12, SA-15, CM-1, CM-2, CM-6, AC-2, AC-3, AC-6, SA-11, AU-6, AU-12, SI-4","2.2, 6.1, 6.2, 6.3, 6.5, 7.1, 10.1, 10.2, 10.3, 10.6, 12.2",AIS-03,,,
SEC-GOV-0011,Governance and strategy,GOV,"Align organization roles, responsibilities and accountabilities","Ensure a multi-cloud strategy is defined in your cloud and security governance, risk management, and operation process which should include the following aspects:

Multi-cloud adoption: For organizations that operate multi-cloud infrastructure and Educate your organization to ensure teams understand the feature difference between the cloud platforms and technology stack. Build, deploy, and/or migrate solutions that are portable. Allow for ease of movement between cloud platforms with minimum vendor lock-in while utilizing cloud native features adequately for the optimal result from the cloud adoption.
Cloud and security operations: Streamline security operations to support the solutions across each cloud, through a central set of governance and management processes which share common operations processes, regardless of where the solution is deployed and operated.
Tooling and technology stack: Choose the appropriate tooling that supports multi-cloud environment to help with establishing unified and centralized management platforms which may include all the security domains discussed in this security benchmark.","1. Are multi-cloud connectors (AWS, GCP) enabled in Defender for Cloud for unified security posture?
2. Are policies and compliance frameworks (CIS, NIST, PCI) applied consistently across Azure, AWS, and GCP?
3. Is Secure Score or equivalent posture score tracked across clouds?","1. Multicloud connector status ( az security connector list ).
2. Compliance exports from Defender for Cloud across providers.
3. Multi-cloud Secure Score dashboard export from Defender for Cloud CSPM.",Multicloud connector status ( az security connector list ) | Compliance exports from Defender for Cloud across providers | Multi-cloud Secure Score dashboard export from Defender for Cloud CSPM,NotStarted,,,0,0.5,,Excel=CSF-AZ-GS-11 | MCSB=GS-11 | CIS=N/A | NIST=N/A,CIS:N/A; NIST:N/A; PCI:N/A; CSA:GRC-10,2025-11-11T17:51:32.035526+00:00,,,,,,,3,,,,CSF-AZ-GS-11,GS-11,N/A,N/A,N/A,GRC-10,,,
SEC-ID-0001,Identity management,ID,Use centralized identity and authentication system,"Use a centralized identity and authentication system to govern your organization's identities and authentications for cloud and non-cloud resources.

Azure Active Directory (Azure AD) is Azure's identity and authentication management service. You should standardize on Azure AD to govern your organization's identity and authentication in:

Microsoft cloud resources, such as Azure Storage, Azure Virtual Machines (Linux and Windows), Azure Key Vault, PaaS, and SaaS applications.
Your organization's resources, such as applications on Azure, third-party applications running on your corporate network resources, and third-party SaaS applications.
Your enterprise identities in Active Directory by synchronization to Azure AD to ensure a consistent and centrally managed identity strategy.
For the Azure services that apply, avoid use of local authentication methods and instead use Azure Active Directory to centralize your service authentications.","1. Are all Azure resources (VMs, SQL, Storage, Key Vault, PaaS) integrated with Azure AD instead of local accounts?
2. Is on-premises Active Directory synchronized with Azure AD using AD Connect or SCIM?
3. Are third-party SaaS applications federated with Azure AD SSO (SAML/OIDC)?","1. Azure AD tenant configuration screenshot (Azure Portal → Azure Active Directory → Overview).
2. Export of Azure AD Connect sync rules (AD Connect → Synchronization Rules Editor).
3. List of Enterprise Applications integrated with SSO (AzureAD PowerShell: Get-AzureADServicePrincipal)",Azure AD tenant configuration screenshot (Azure Portal → Azure Active Directory → Overview) | Export of Azure AD Connect sync rules (AD Connect → Synchronization Rules Editor) | List of Enterprise Applications integrated with SSO (AzureAD PowerShell: Get-AzureADServicePrincipal),NotStarted,,,0,0.85,"Observations: CONTOSO uses AD on-prem with AD Connect to synchronize user accounts to Entra ID.
Observed that some storage accounts are enabled with shared key access","Excel=CSF-AZ-IM-01 | MCSB=IM-1 | DocID=IM-1 | CIS=6.7, 12.5 | NIST=AC-2, AC-3, IA-2, IA-8","CIS:6.7, 12.5; NIST:AC-2, AC-3, IA-2, IA-8; PCI:7.2, 8.3; CSA:IAM-01, IAM-02, IAM-03; DocStatus:Partial - Compliant",2025-11-11T17:51:32.035526+00:00,IM-1,Partial - Compliant,High,"CONTOSO uses AD on-prem with AD Connect to synchronize user accounts to Entra ID.
Observed that some storage accounts are enabled with shared key access",,1. Meeting notes and defender for cloud.,3,,,,CSF-AZ-IM-01,IM-1,"6.7, 12.5","AC-2, AC-3, IA-2, IA-8","7.2, 8.3","IAM-01, IAM-02, IAM-03",,,
SEC-ID-0002,Identity management,ID,Protect identity and authentication systems,"Secure your identity and authentication system as a high priority in your organization's cloud security practice. Common security controls include:

1. Restrict privileged roles and accounts
2. Require strong authentication for all privileged access
3. Monitor and audit high risk activities

Use the Azure AD security baseline and the Azure AD Identity Secure Score to evaluate your Azure AD identity security posture, and remediate security and configuration gaps. The Azure AD Identity Secure Score evaluates Azure AD for the following configurations:

Use limited administrative roles
Turn on user risk policy
Designate more than one global admin
Enable policy to block legacy authentication
Ensure all users can complete multi-factor authentication for secure access
Require MFA for administrative roles
Enable self-service password reset
Do not expire passwords
Turn on sign-in risk policy
Do not allow users to grant consent to unmanaged applications
Use Azure AD Identity Protection to detect, investigate, and remediate identity-based risks. To similarly protect your on-premises Active Directory domain, use Defender for Identity.","1. Is Azure AD Identity Secure Score reviewed and tracked for remediation?
2. Are Identity Protection policies (user risk, sign-in risk) enabled?
3. Is Microsoft Defender for Identity deployed to monitor on-premises AD for lateral movement, credential theft, and Kerberos abuse?
4. Is logging enabled for privileged role assignments and admin consent to applications?","1. Azure AD Identity Secure Score export (Azure Portal → Security → Identity Secure Score → Export).
2. Conditional Access and Identity Protection policy export (AzureAD PowerShell: Get-AzureADMSConditionalAccessPolicy).
3. Defender for Identity sensor deployment status (Defender for Identity Portal → Configuration → Sensors).
4. Azure AD Audit logs for role assignments (AzureAD PowerShell: Get-AzureADAuditDirectoryLogs).",Azure AD Identity Secure Score export (Azure Portal → Security → Identity Secure Score → Export) | Conditional Access and Identity Protection policy export (AzureAD PowerShell: Get-AzureADMSConditionalAccessPolicy) | Defender for Identity sensor deployment status (Defender for Identity Portal → Configuration → Sensors) | Azure AD Audit logs for role assignments (AzureAD PowerShell: Get-AzureADAuditDirectoryLogs),Complete,,,100,0.85,"Observations: MFA is mandated for all administrator level access
CyberArk is configured as PAM
EntraID PIM is also in use","Excel=CSF-AZ-IM-02 | MCSB=IM-2 | DocID=IM-2 | CIS=5.4, 6.5 | NIST=AC-2, AC-3, IA-2, IA-8, SI-4","CIS:5.4, 6.5; NIST:AC-2, AC-3, IA-2, IA-8, SI-4; PCI:8.2, 8.3; CSA:IAM-05, IAM-06, IVS-05; DocStatus:Compliant",2025-11-11T17:51:32.035526+00:00,IM-2,Compliant,High,"MFA is mandated for all administrator level access
CyberArk is configured as PAM
EntraID PIM is also in use",,1. Meeting notes.,4,,,,CSF-AZ-IM-02,IM-2,"5.4, 6.5","AC-2, AC-3, IA-2, IA-8, SI-4","8.2, 8.3","IAM-05, IAM-06, IVS-05",,,
SEC-ID-0003,Identity management,ID,Manage application identities securely and automatically,"Use managed application identities instead of creating human accounts for applications to access resources and execute code. Managed application identities provide benefits such as reducing the exposure of credentials. Automate the rotation of credentials to ensure the security of the identities.

Use Azure managed identities, which can authenticate to Azure services and resources that support Azure AD authentication. Managed identity credentials are fully managed, rotated, and protected by the platform, avoiding hard-coded credentials in source code or configuration files.

For services that don't support managed identities, use Azure AD to create a service principal with restricted permissions at the resource level. It is recommended to configure service principals with certificate credentials and fall back to client secrets for authentication.","1. Are Managed Identities used for applications instead of hard-coded credentials?
2. For applications that require service principals, are certificate-based credentials enforced over client secrets?
3. Is credential rotation automated via Key Vault?
4. Are service principal permissions restricted to least privilege?","1. List of resources with Managed Identities enabled (Azure CLI: az resource list --query ""[?identity!=null]"").
2. Service principal credential types (Azure CLI: az ad sp credential list --id <AppID>).
3. Key Vault secret rotation policy JSON export (az keyvault secret show --vault-name <vault> --name <secret>).
4. Role assignments of service principals (Azure CLI: az role assignment list --assignee <AppID>)","List of resources with Managed Identities enabled (Azure CLI: az resource list --query ""[?identity!=null]"") | Service principal credential types (Azure CLI: az ad sp credential list --id <AppID>) | Key Vault secret rotation policy JSON export (az keyvault secret show --vault-name <vault> --name <secret>) | Role assignments of service principals (Azure CLI: az role assignment list --assignee <AppID>)",NotStarted,,,0,0.5,,"Excel=CSF-AZ-IM-03 | MCSB=IM-3: | CIS=N/A | NIST=AC-2, AC-3, IA-4, IA-5, IA-9","CIS:N/A; NIST:AC-2, AC-3, IA-4, IA-5, IA-9; PCI:N/A; CSA:IAM-07, IAM-08, IAM-09",2025-11-11T17:51:32.035526+00:00,,,,,,,4,,,,CSF-AZ-IM-03,IM-3:,N/A,"AC-2, AC-3, IA-4, IA-5, IA-9",N/A,"IAM-07, IAM-08, IAM-09",,,
SEC-ID-0004,Identity management,ID,Authenticate server and services,"Authenticate remote servers and services from your client side to ensure you are connecting to trusted server and services. The most common server authentication protocol is Transport Layer Security (TLS), where the client-side (often a browser or client device) verifies the server by verifying the server’s certificate was issued by a trusted certificate authority.

Many Azure services support TLS authentication by default. For services that don't support TLS authentication by default, or support disabling TLS, ensure it is always enabled to support the server/client authentication. Your client application should also be designed to verify server/client identity (by verifying the server’s certificate issued by a trusted certificate authority) in the handshake stage.","1. Is HTTPS/TLS enforced on all Azure services (Storage, App Services, Key Vault)?
2. Are certificates issued from trusted CAs and stored in Azure Key Vault/App Service Certificates?
3. Is mutual TLS (mTLS) configured where service-to-service trust is required?
4. Are legacy/unencrypted protocols disabled (FTP, LDAP without TLS, HTTP)?","1. Azure Policy compliance report for “HTTPS Only” (Azure Policy → Assignments →Effect: Deny).
2. Key Vault certificate inventory export (az keyvault certificate list --vault-name <vault>).
3. App Gateway / API Management TLS configuration JSON.
4. List of enabled protocols per Storage account (az storage account show --name <storage> --query ""enableHttpsTrafficOnly"").","Azure Policy compliance report for “HTTPS Only” (Azure Policy → Assignments →Effect: Deny) | Key Vault certificate inventory export (az keyvault certificate list --vault-name <vault>) | App Gateway / API Management TLS configuration JSON | List of enabled protocols per Storage account (az storage account show --name <storage> --query ""enableHttpsTrafficOnly"")",Complete,,,100,0.85,"Observations: Currently no VM/Servers are being utilised 
Resources (Storage and DB) are configured with TLS 1.2",Excel=CSF-AZ-IM-04 | MCSB=IM-4 | DocID=IM-4 | CIS=N/A | NIST=IA-9,"CIS:N/A; NIST:IA-9; PCI:N/A; CSA:IAM-10, IAM-11, IAM-12; DocStatus:Compliant",2025-11-11T17:51:32.035526+00:00,IM-4,Compliant,High,"Currently no VM/Servers are being utilised 
Resources (Storage and DB) are configured with TLS 1.2",,Meeting notes and Defender for Cloud,4,,,,CSF-AZ-IM-04,IM-4,N/A,IA-9,N/A,"IAM-10, IAM-11, IAM-12",,,
SEC-ID-0005,Identity management,ID,Use single sign-on (SSO) for application access,"Use single sign-on (SSO) to simplify the user experience for authenticating to resources including applications and data across cloud services and on-premises environments.

Use Azure AD for workload application access (customer facing) access through Azure AD single sign-on (SSO), reducing the need for duplicate accounts. Azure AD provides identity and access management to Azure resources (in the management plane, including CLI, PowerShell, the portal), cloud applications, and on-premises applications.","1. Are enterprise SaaS applications federated with Azure AD using SAML or OIDC?
2. Are guest users accessing apps via Azure AD B2B configured with Conditional Access policies?
3. Are any applications still using standalone logins outside Azure AD federation?","1. Enterprise Application list (AzureAD PowerShell: Get-AzureADServicePrincipal | Select DisplayName, AppId).
2. Federation settings for B2B/B2C (Azure AD → External Identities → Cross-tenant access).
3. Conditional Access policy assignments for SaaS apps.
4. Sign-in logs showing federated vs non-federated authentication (Azure Portal → Azure AD → Sign-ins)","Enterprise Application list (AzureAD PowerShell: Get-AzureADServicePrincipal | Select DisplayName, AppId) | Federation settings for B2B/B2C (Azure AD → External Identities → Cross-tenant access) | Conditional Access policy assignments for SaaS apps | Sign-in logs showing federated vs non-federated authentication (Azure Portal → Azure AD → Sign-ins)",Complete,,,100,0.6,Observations: Okta and Entra ID configured.,"Excel=CSF-AZ-IM-05 | MCSB=IM-5 | DocID=IM-5 | CIS=12.5 | NIST=IA-4, IA-2, IA-8","CIS:12.5; NIST:IA-4, IA-2, IA-8; PCI:N/A; CSA:IAM-13, IAM-14; DocStatus:Compliant",2025-11-11T17:51:32.035526+00:00,IM-5,Compliant,Medium,Okta and Entra ID configured.,,1. Meeting notes.,4,,,,CSF-AZ-IM-05,IM-5,12.5,"IA-4, IA-2, IA-8",N/A,"IAM-13, IAM-14",,,
SEC-ID-0006,Identity management,ID,Use strong authentication controls,"Enforce strong authentication controls (strong passwordless authentication or multi-factor authentication) with your centralized identity and authentication management system for all access to resources. Authentication based on password credentials alone is considered legacy, as it is insecure and does not stand up to popular attack methods.
When deploying strong authentication, configure administrators and privileged users first, to ensure the highest level of the strong authentication method, quickly followed by rolling out the appropriate strong authentication policy to all users.

Azure AD supports strong authentication controls through passwordless methods and multi-factor authentication (MFA).

Passwordless authentication: Use passwordless authentication as your default authentication method. There are three options available in passwordless authentication: Windows Hello for Business, Microsoft Authenticator app phone sign-in, and FIDO2 security keys. In addition, customers can use on-premises authentication methods such as smart cards.
Multi-factor authentication: Azure MFA can be enforced on all users, select users, or at the per-user level based on sign-in conditions and risk factors. Enable Azure MFA and follow Microsoft Defender for Cloud identity and access management recommendations for your MFA setup.
If legacy password-based authentication is still used for Azure AD authentication, be aware that cloud-only accounts (user accounts created directly in Azure) have a default baseline password policy. And hybrid accounts (user accounts that come from on-premises Active Directory) follow the on-premises password policies.

For third-party applications and services that may have default IDs and passwords, you should disable or change them during initial service setup.","1. Is MFA enforced for all privileged accounts and end users via Conditional Access?
2. Are passwordless authentication methods (FIDO2, Authenticator app, Windows Hello) enabled?
3. Is Azure AD Password Protection in place with custom banned password lists?
4. Are break-glass accounts exempt from MFA but monitored with alerts?","1. Conditional Access policies export (Get-AzureADMSConditionalAccessPolicy).
2. MFA registration report (Azure AD → Security → MFA → Registration Details).
3. Azure AD Password Protection policy configuration (Azure AD → Security →
Authentication Methods → Password Protection).
4. Azure Monitor alerts for break-glass account usage.",Conditional Access policies export (Get-AzureADMSConditionalAccessPolicy) | MFA registration report (Azure AD → Security → MFA → Registration Details) | Azure AD Password Protection policy configuration (Azure AD → Security → | Authentication Methods → Password Protection) | Azure Monitor alerts for break-glass account usage,Complete,,,100,0.85,"Observations: MFA is Enforced for administrative access
CyberArk is used PAM","Excel=CSF-AZ-IM-06 | MCSB=IM-6 | DocID=IM-6 | CIS=6.3, 6.4 | NIST=AC-2, AC-3, IA-2, IA-5, IA-8","CIS:6.3, 6.4; NIST:AC-2, AC-3, IA-2, IA-5, IA-8; PCI:7.2, 8.2, 8.3, 8.4; CSA:IAM-15, IAM-16; DocStatus:Compliant",2025-11-11T17:51:32.035526+00:00,IM-6,Compliant,High,"MFA is Enforced for administrative access
CyberArk is used PAM",,1. Meeting notes.,4,,,,CSF-AZ-IM-06,IM-6,"6.3, 6.4","AC-2, AC-3, IA-2, IA-5, IA-8","7.2, 8.2, 8.3, 8.4","IAM-15, IAM-16",,,
SEC-ID-0007,Identity management,ID,Restrict resource access based on conditions,"Explicitly validate trusted signals to allow or deny user access to resources, as part of a zero-trust access model. Signals to validate should include strong authentication of user account, behavioral analytics of user account, device trustworthiness, user or group membership, locations and so on.

Use Azure AD conditional access for more granular access controls based on user-defined conditions, such as requiring user logins from certain IP ranges (or devices) to use MFA. Azure AD Conditional Access allows you to enforce access controls on your organization’s apps based on certain conditions.

Define the applicable conditions and criteria for Azure AD conditional access in the workload. Consider the following common use cases:

Requiring multi-factor authentication for users with administrative roles
Requiring multi-factor authentication for Azure management tasks
Blocking sign-ins for users attempting to use legacy authentication protocols
Requiring trusted locations for Azure AD Multi-Factor Authentication registration
Blocking or granting access from specific locations
Blocking risky sign-in behaviors
Requiring organization-managed devices for specific applications
Note: Granular authentication session management controls can also be implemented through Azure AD conditional access policy, such as sign-in frequency and persistent browser session.","1. Are Conditional Access policies applied based on device compliance (Intune), location, or risk level?
2. Are session controls (sign-in frequency, persistent browser sessions) enforced?
3. Are Conditional Access policies tested against high-risk users and applications?","1. Full Conditional Access policy JSON export.
2. Intune compliance policy configuration export.
3. Azure AD sign-in logs showing risk-based MFA enforcement.
4. Conditional Access “What-If” test results (Azure Portal → Conditional Access → What If).",Full Conditional Access policy JSON export | Intune compliance policy configuration export | Azure AD sign-in logs showing risk-based MFA enforcement | Conditional Access “What-If” test results (Azure Portal → Conditional Access → What If),Complete,,,100,0.85,Observations: Zero Trust Principles: Geolocation-based access policies are enabled and applied almost universally as a key feature of the zero-trust strategy.,"Excel=CSF-AZ-IM-07 | MCSB=IM-7 | DocID=IM-7 | CIS=3.3, 6.4, 13.5 | NIST=AC-2, AC-3, AC-6","CIS:3.3, 6.4, 13.5; NIST:AC-2, AC-3, AC-6; PCI:7.2; CSA:IAM-04, IAM-17; DocStatus:Compliant",2025-11-11T17:51:32.035526+00:00,IM-7,Compliant,High,Zero Trust Principles: Geolocation-based access policies are enabled and applied almost universally as a key feature of the zero-trust strategy.,,1. Meeting notes.,4,,,,CSF-AZ-IM-07,IM-7,"3.3, 6.4, 13.5","AC-2, AC-3, AC-6",7.2,"IAM-04, IAM-17",,,
